{
  "meta": {
    "schema_version": 1,
    "tracking_issue": 2246,
    "status": "adopted-design",
    "phase": "phase-1"
  },
  "policy_sources": [
    {
      "id": "label-policy",
      "path": ".github/label-policy.toml",
      "format": "toml",
      "authority": "label taxonomy design: families, renames, retirements, area paths"
    },
    {
      "id": "labels-live",
      "path": ".github/labels.json",
      "format": "json",
      "authority": "live label catalog applied to GitHub"
    },
    {
      "id": "agent-hooks-source",
      "path": "scripts/agent_hooks_source.json",
      "format": "json",
      "authority": "generation source for the per-agent hook surfaces"
    },
    {
      "id": "rulesets-main",
      "path": ".github/rulesets/main.json",
      "format": "json",
      "authority": "GitHub ruleset: required checks and native branch rules"
    },
    {
      "id": "doc-dependencies",
      "path": ".gitapex/doc-dependencies.toml",
      "format": "toml",
      "authority": "typed document dependency graph for PR governance co-change enforcement"
    },
    {
      "id": "loop-engineering-audit",
      "path": ".gitapex/loop-engineering-audit.toml",
      "format": "toml",
      "authority": "loop-engineering achievement audit checklist"
    },
    {
      "id": "module-size-distribution",
      "path": ".gitapex/snapshots/module-size-distribution.toml",
      "format": "toml",
      "authority": "scripts/*.py physical-line size distribution snapshot"
    },
    {
      "id": "pr-body-quality-enforcement",
      "path": ".gitapex/pr-body-quality.enforcement.toml",
      "format": "toml",
      "authority": "PR body content-quality defect-class enforcement registry"
    },
    {
      "id": "workflow-script-quality-enforcement",
      "path": ".gitapex/workflow-script-quality.enforcement.toml",
      "format": "toml",
      "authority": "workflow-script-quality standard must-have enforcement registry"
    },
    {
      "id": "llm-budget-policy",
      "path": ".gitapex/llm-budget-policy.toml",
      "format": "toml",
      "authority": "LLM invocation marker list and per-workflow token/cost budget requirements"
    }
  ],
  "gates": [
    {
      "id": "block-sensitive-reads",
      "kind": "script",
      "script": "scripts/block_sensitive_reads.py",
      "rule": "reads of local credential files are blocked",
      "planes": [
        "pretooluse"
      ],
      "trigger": "Read or Bash tool use",
      "policy_refs": [],
      "cluster": null,
      "tracking_issue": null
    },
    {
      "id": "preflight-non-ascii",
      "kind": "script",
      "script": "scripts/preflight_non_ascii.py",
      "rule": "GitHub-bound text is ASCII",
      "planes": [
        "pretooluse"
      ],
      "trigger": "GitHub MCP write tools",
      "policy_refs": [],
      "cluster": "non-ascii",
      "tracking_issue": null
    },
    {
      "id": "preflight-github-secrets",
      "kind": "script",
      "script": "scripts/preflight_github_secrets.py",
      "rule": "GitHub-bound text carries no secret values",
      "planes": [
        "pretooluse"
      ],
      "trigger": "GitHub MCP write tools",
      "policy_refs": [],
      "cluster": null,
      "tracking_issue": null
    },
    {
      "id": "preflight-angle-token-drop",
      "kind": "script",
      "script": "scripts/preflight_angle_token_drop.py",
      "rule": "GitHub-bound text has no bare angle-bracket tokens the MCP layer would drop",
      "planes": [
        "pretooluse"
      ],
      "trigger": "GitHub MCP write tools",
      "policy_refs": [],
      "cluster": null,
      "tracking_issue": null
    },
    {
      "id": "preflight-codex-github-footer",
      "kind": "script",
      "script": "scripts/preflight_codex_github_footer.py",
      "rule": "Codex-authored GitHub posts carry the required Codex attribution footer",
      "planes": [
        "pretooluse"
      ],
      "trigger": "Codex GitHub write tools",
      "policy_refs": [],
      "cluster": null,
      "tracking_issue": null
    },
    {
      "id": "issue-closure-fast-path",
      "kind": "script",
      "script": "scripts/issue_closure_fast_path.py",
      "rule": "issue closure carries closing evidence",
      "planes": [
        "pretooluse"
      ],
      "trigger": "mcp__github__issue_write",
      "policy_refs": [],
      "cluster": null,
      "tracking_issue": null
    },
    {
      "id": "gate-issue-close-comment",
      "kind": "script",
      "script": "scripts/gate_issue_close_comment.py",
      "rule": "an issue close is preceded by a closing comment",
      "planes": [
        "pretooluse"
      ],
      "trigger": "mcp__github__issue_write",
      "policy_refs": [],
      "cluster": null,
      "tracking_issue": null
    },
    {
      "id": "gate-issue-classification-labels",
      "kind": "script",
      "script": "scripts/gate_issue_classification_labels.py",
      "rule": "agent-created issues carry layer:* and type:* labels",
      "planes": [
        "pretooluse"
      ],
      "trigger": "mcp__github__issue_write create",
      "policy_refs": [
        "labels-live",
        "label-policy"
      ],
      "cluster": null,
      "tracking_issue": null
    },
    {
      "id": "gate-reserved-retro-scope",
      "kind": "script",
      "script": "scripts/gate_reserved_retro_scope.py",
      "rule": "the reserved auto-retro issue scope is not hand-created",
      "planes": [
        "pretooluse"
      ],
      "trigger": "mcp__github__issue_write",
      "policy_refs": [],
      "cluster": null,
      "tracking_issue": null
    },
    {
      "id": "preflight-issue-ci-staleness",
      "kind": "script",
      "script": "scripts/preflight_issue_ci_staleness.py",
      "rule": "issue creation checks CI-failure staleness first",
      "planes": [
        "pretooluse"
      ],
      "trigger": "mcp__github__issue_write",
      "policy_refs": [],
      "cluster": null,
      "tracking_issue": null
    },
    {
      "id": "gate-update-pr-branch",
      "kind": "script",
      "script": "scripts/gate_update_pr_branch.py",
      "rule": "update_pull_request_branch is blocked in favor of the new-branch recovery path",
      "planes": [
        "pretooluse"
      ],
      "trigger": "mcp__github__update_pull_request_branch",
      "policy_refs": [],
      "cluster": null,
      "tracking_issue": null
    },
    {
      "id": "gate-merge-safety",
      "kind": "script",
      "script": "scripts/gate_merge_safety.py",
      "rule": "a PR merges only when mergeable_state is clean",
      "planes": [
        "pretooluse"
      ],
      "trigger": "mcp__github__merge_pull_request",
      "policy_refs": [],
      "cluster": null,
      "tracking_issue": null
    },
    {
      "id": "preflight-main-freshness",
      "kind": "script",
      "script": "scripts/preflight_main_freshness.py",
      "rule": "branch creation checks origin/main freshness",
      "planes": [
        "pretooluse"
      ],
      "trigger": "mcp__github__create_branch",
      "policy_refs": [],
      "cluster": null,
      "tracking_issue": null
    },
    {
      "id": "gate-irreversible-bash",
      "kind": "script",
      "script": "scripts/gate_irreversible_bash.py",
      "rule": "irreversible bash operations are guarded",
      "planes": [
        "pretooluse"
      ],
      "trigger": "Bash tool use",
      "policy_refs": [],
      "cluster": null,
      "tracking_issue": null
    },
    {
      "id": "gate-gh-cli",
      "kind": "script",
      "script": "scripts/gate_gh_cli.py",
      "rule": "prohibited gh CLI usage is blocked",
      "planes": [
        "pretooluse"
      ],
      "trigger": "Bash tool use",
      "policy_refs": [],
      "cluster": null,
      "tracking_issue": null
    },
    {
      "id": "gate-unsigned-commit-bash",
      "kind": "script",
      "script": "scripts/gate_unsigned_commit_bash.py",
      "rule": "a commit-signing bypass on a git command is blocked",
      "planes": [
        "pretooluse"
      ],
      "trigger": "Bash git command",
      "policy_refs": [],
      "cluster": null,
      "tracking_issue": null
    },
    {
      "id": "preflight-push-unsigned-commits",
      "kind": "script",
      "script": "scripts/preflight_push_unsigned_commits.py",
      "rule": "pushed commits are signed",
      "planes": [
        "pretooluse"
      ],
      "trigger": "Bash git push",
      "policy_refs": [],
      "cluster": null,
      "tracking_issue": null
    },
    {
      "id": "preflight-push-base",
      "kind": "script",
      "script": "scripts/preflight_push_base.py",
      "rule": "the branch base is current before a push",
      "planes": [
        "pretooluse"
      ],
      "trigger": "Bash git push",
      "policy_refs": [],
      "cluster": null,
      "tracking_issue": null
    },
    {
      "id": "preflight-push-session-branch",
      "kind": "script",
      "script": "scripts/preflight_push_session_branch.py",
      "rule": "a push targets the authorized session branch",
      "planes": [
        "pretooluse"
      ],
      "trigger": "Bash git push",
      "policy_refs": [],
      "cluster": null,
      "tracking_issue": null
    },
    {
      "id": "preflight-commit-session-branch",
      "kind": "script",
      "script": "scripts/preflight_commit_session_branch.py",
      "rule": "a commit lands on the authorized session branch",
      "planes": [
        "pretooluse"
      ],
      "trigger": "Bash git commit",
      "policy_refs": [],
      "cluster": null,
      "tracking_issue": null
    },
    {
      "id": "check-commit-signing-ready",
      "kind": "script",
      "script": "scripts/check_commit_signing_ready.py",
      "rule": "commit signing is configured before a git operation",
      "planes": [
        "pretooluse"
      ],
      "trigger": "Bash git command",
      "policy_refs": [],
      "cluster": null,
      "tracking_issue": null
    },
    {
      "id": "gate-retro-close-keyword-commit",
      "kind": "script",